{"band_all_id":"all","bands":[{"hours":[0,1,2,3,4,5],"id":"overnight","label":"Overnight 12-6 AM"},{"hours":[6,7,8,9],"id":"am_peak","label":"AM peak 6-10 AM"},{"hours":[10,11,12,13,14,15],"id":"midday","label":"Midday 10 AM-4 PM"},{"hours":[16,17,18,19],"id":"pm_peak","label":"PM peak 4-8 PM"},{"hours":[20,21,22,23],"id":"evening","label":"Evening 8 PM-12 AM"}],"columns":["o","d","band","trips","dur_p10_min","dur_p50_min","dur_p90_min","spd_p10","spd_p50","spd_p90","dist_mi"],"definition":"directed corridors (o != d), top 300 per band and top 2000 for band 'all', cells >= 11 trips; quantiles exact over 2024 trips","rows":[[36,37,"overnight",64140,4.3,7.0,11.1,8.1,10.8,13.7,1.23],[37,36,"overnight",43571,4.2,7.1,11.5,8.0,10.6,13.6,1.23],[148,79,"overnight",42775,4.2,6.9,10.8,5.5,8.1,11.4,0.93],[216,132,"overnight",39830,5.4,9.9,16.4,13.2,21.6,29.1,3.82],[36,198,"overnight",37536,4.0,7.0,10.8,8.4,10.9,13.5,1.26],[249,79,"overnight",37317,6.5,9.8,14.3,5.9,8.0,10.7,1.29],[80,37,"overnight",36812,5.1,9.8,16.1,8.3,10.8,13.3,1.7],[230,138,"overnight",34211,20.5,24.0,29.5,18.1,26.0,31.0,10.27],[79,148,"overnight",34027,4.5,7.9,13.1,4.5,7.1,10.4,0.95],[37,225,"overnight",32397,4.4,7.5,12.2,7.9,10.5,13.5,1.3],[36,225,"overnight",31566,6.7,9.6,13.5,8.4,10.7,13.2,1.7],[255,112,"overnight",30799,4.2,6.7,10.0,8.3,11.3,14.4,1.24],[79,170,"overnight",30588,5.3,8.5,13.0,8.9,12.1,16.5,1.7],[37,198,"overnight",30410,6.5,9.9,14.2,8.6,11.1,14.0,1.81],[79,107,"overnight",28760,3.3,6.0,10.1,7.1,10.1,14.4,1.01],[7,223,"overnight",28613,5.1,7.9,11.6,8.7,11.3,14.5,1.49],[114,79,"overnight",28438,4.3,7.3,11.4,5.7,8.0,11.1,0.98],[37,61,"overnight",27547,8.7,13.1,18.7,9.6,12.0,14.7,2.65],[79,249,"overnight",26819,6.8,10.1,14.3,6.2,8.1,10.9,1.37],[198,37,"overnight",26624,5.8,9.3,13.7,8.7,11.2,14.0,1.71],[79,137,"overnight",26188,4.3,6.9,10.7,8.5,11.9,16.6,1.39],[255,37,"overnight",26040,9.6,15.4,22.1,8.4,10.4,12.6,2.64],[256,37,"overnight",25735,7.7,13.5,20.1,8.2,10.3,12.6,2.27],[225,61,"overnight",25693,5.0,8.9,13.7,8.6,11.3,14.2,1.68],[129,82,"overnight",25099,4.8,8.1,12.8,6.9,9.6,12.7,1.26],[255,80,"overnight",24795,5.2,8.1,13.4,7.2,9.6,12.2,1.28],[82,129,"overnight",24737,4.8,7.9,12.2,6.6,9.3,13.4,1.2],[61,225,"overnight",24107,4.4,8.7,13.6,9.0,11.8,15.0,1.66],[37,17,"overnight",23988,6.0,9.8,14.5,8.8,11.2,13.9,1.85],[80,36,"overnight",23885,5.8,10.4,15.9,8.5,11.0,13.6,1.9],[37,80,"overnight",23734,4.6,8.3,14.4,7.9,10.4,13.3,1.43],[255,256,"overnight",23467,4.0,6.2,9.4,6.7,9.4,12.5,0.97],[80,112,"overnight",22636,5.6,9.1,14.5,8.1,10.8,13.7,1.61],[10,132,"overnight",22404,7.8,11.1,16.9,13.2,19.1,25.6,3.73],[225,37,"overnight",22332,4.7,7.8,12.0,7.4,10.1,12.9,1.31],[79,68,"overnight",22082,9.2,13.0,18.2,7.7,10.3,13.4,2.27],[230,132,"overnight",21702,29.4,36.4,49.8,22.1,29.6,35.8,17.54],[198,36,"overnight",21671,4.1,7.0,10.7,8.3,10.9,13.7,1.25],[61,188,"overnight",21618,5.4,8.8,13.6,9.1,12.0,15.3,1.76],[144,79,"overnight",21589,4.7,7.7,11.9,5.8,8.2,11.1,1.04],[36,61,"overnight",21467,11.7,16.2,22.0,9.7,11.8,14.2,3.27],[17,61,"overnight",21427,4.8,8.1,12.7,8.7,11.8,15.2,1.57],[36,80,"overnight",21364,5.6,9.2,14.0,8.4,11.1,13.8,1.71],[35,76,"overnight",20991,6.7,10.9,15.9,9.5,12.1,14.8,2.16],[148,107,"overnight",20851,5.9,9.3,14.3,7.2,9.9,13.4,1.53],[223,7,"overnight",20675,4.8,7.5,11.0,8.4,11.2,14.4,1.42],[148,37,"overnight",20298,13.9,19.9,28.2,10.4,13.1,16.3,4.26],[197,216,"overnight",20259,4.3,7.7,12.6,9.5,12.8,19.0,1.63],[79,87,"overnight",20187,9.9,12.5,16.9,8.7,13.0,19.8,2.85],[148,87,"overnight",20185,7.4,10.2,13.9,8.0,10.3,16.5,1.69],[48,138,"overnight",20170,21.4,25.1,31.1,17.8,24.7,29.5,10.22],[79,144,"overnight",20148,5.3,8.4,12.6,5.7,7.9,10.7,1.12],[256,112,"overnight",19884,6.5,9.2,12.8,8.1,11.0,14.6,1.69],[76,132,"overnight",19867,9.7,14.9,22.1,17.9,24.8,31.8,6.66],[41,42,"overnight",19791,4.3,7.3,11.4,7.8,10.7,13.8,1.28],[148,249,"overnight",19686,7.8,11.3,15.9,6.7,8.9,11.6,1.66],[48,68,"overnight",19659,3.1,5.9,10.8,7.9,12.8,19.0,1.27],[7,138,"overnight",19613,7.4,10.3,14.1,16.1,22.6,28.4,3.92],[79,48,"overnight",19613,12.8,17.1,23.3,9.4,12.1,15.0,3.42],[246,48,"overnight",19494,3.8,6.2,10.6,7.9,12.3,16.8,1.3],[7,179,"overnight",19463,3.9,6.5,10.1,8.2,10.9,13.9,1.15],[80,225,"overnight",19462,7.9,12.0,17.5,8.7,11.1,13.6,2.21],[132,216,"overnight",19462,5.3,9.3,14.8,12.0,19.6,28.4,3.22],[79,90,"overnight",19427,6.9,10.4,15.0,7.4,9.7,12.5,1.7],[148,170,"overnight",19382,8.8,12.3,17.5,8.7,11.8,16.0,2.34],[249,68,"overnight",19382,4.2,7.3,11.8,7.5,11.4,15.8,1.39],[215,130,"overnight",19373,4.3,6.5,9.8,9.1,11.9,15.0,1.26],[256,80,"overnight",19316,4.5,8.0,13.0,7.3,9.8,12.9,1.29],[48,246,"overnight",19235,4.3,6.6,10.6,8.2,12.4,16.5,1.43],[36,17,"overnight",19095,9.1,12.7,17.1,9.1,11.3,13.8,2.41],[129,138,"overnight",19029,5.4,9.1,13.4,11.1,16.8,24.6,2.57],[7,129,"overnight",18992,6.9,10.8,15.8,10.2,13.9,18.7,2.48],[61,132,"overnight",18920,25.8,32.0,41.9,16.0,20.0,23.8,10.63],[17,225,"overnight",18789,4.4,7.3,11.3,8.3,11.1,14.0,1.33],[249,148,"overnight",18628,8.5,12.2,18.0,5.5,7.9,10.8,1.6],[39,76,"overnight",18556,4.8,9.9,16.1,10.8,13.9,19.0,2.32],[112,80,"overnight",18414,5.1,8.6,13.8,7.8,10.2,13.2,1.46],[130,215,"overnight",18368,4.6,7.2,10.4,9.2,12.0,14.7,1.39],[249,231,"overnight",18349,5.7,8.7,13.1,7.4,10.2,13.9,1.48],[249,170,"overnight",18348,8.6,11.8,16.9,8.3,11.1,14.7,2.19],[79,233,"overnight",18292,5.8,8.9,13.4,10.1,13.7,18.3,2.02],[80,255,"overnight",18290,5.2,9.2,14.6,7.2,9.9,12.6,1.45],[255,36,"overnight",18084,12.0,16.1,22.0,8.9,11.0,13.3,2.9],[112,37,"overnight",18004,10.3,15.9,23.0,8.9,10.8,13.0,2.84],[148,231,"overnight",17680,6.4,9.5,13.8,6.8,8.9,11.3,1.4],[164,138,"overnight",17673,17.6,20.5,26.4,22.8,28.6,32.7,9.63],[61,17,"overnight",17656,4.8,8.2,12.7,8.9,11.9,15.3,1.61],[80,256,"overnight",17627,4.8,8.9,14.4,7.4,10.1,13.1,1.45],[79,37,"overnight",17610,17.3,23.9,33.3,9.9,12.7,15.9,4.92],[249,107,"overnight",17555,6.8,9.7,14.2,7.0,9.6,13.0,1.57],[228,14,"overnight",17543,5.3,8.8,13.9,9.1,12.8,21.5,2.03],[79,231,"overnight",17472,8.2,11.8,16.5,7.4,9.6,12.9,1.88],[188,61,"overnight",17471,5.2,8.8,13.9,9.3,12.4,15.4,1.8],[249,90,"overnight",17452,3.3,5.7,9.2,7.2,10.8,15.4,1.03],[256,36,"overnight",17264,10.5,15.4,21.4,8.8,10.9,13.4,2.76],[148,68,"overnight",17216,12.1,16.1,21.7,8.1,10.8,13.8,2.89],[79,186,"overnight",17110,8.4,11.9,16.9,8.2,11.0,14.1,2.18],[249,48,"overnight",17066,8.2,12.3,18.3,9.4,13.0,16.9,2.64],[148,256,"overnight",17020,6.7,10.0,15.7,10.1,14.4,19.3,2.36],[79,164,"overnight",16900,7.0,10.5,15.5,8.1,10.9,14.5,1.92],[80,61,"overnight",16896,12.5,16.8,22.9,10.2,12.6,15.2,3.5],[112,255,"overnight",16776,4.1,6.6,10.2,7.7,10.7,13.7,1.16],[243,244,"overnight",16708,4.3,7.4,11.4,7.4,10.3,15.6,1.26],[80,17,"overnight",16608,7.5,11.6,16.6,9.2,11.8,14.8,2.31],[17,37,"overnight",16444,6.7,10.5,14.9,8.6,10.9,13.3,1.91],[114,148,"overnight",16432,4.9,8.4,13.7,4.7,7.1,9.9,1.0],[79,114,"overnight",16374,4.6,7.5,11.7,5.4,7.7,10.6,0.97],[80,198,"overnight",16307,7.3,11.9,17.9,9.7,12.3,15.2,2.51],[107,79,"overnight",16304,3.8,6.7,10.9,6.3,9.0,13.0,1.02],[77,76,"overnight",16295,4.1,7.0,10.9,8.6,11.8,14.8,1.32],[225,17,"overnight",16283,4.4,7.6,11.5,8.3,11.0,14.2,1.38],[256,17,"overnight",16281,7.2,10.7,15.2,8.5,11.2,14.2,2.04],[68,48,"overnight",16176,4.2,7.5,12.9,7.4,12.0,16.8,1.51],[76,35,"overnight",16030,6.9,11.1,16.6,9.4,11.9,14.6,2.18],[61,37,"overnight",15973,8.5,13.4,18.7,9.3,11.6,14.0,2.6],[225,36,"overnight",15904,6.2,9.4,13.5,8.0,10.4,12.9,1.62],[260,129,"overnight",15892,5.3,8.8,13.1,7.9,10.7,16.4,1.58],[112,256,"overnight",15708,6.5,9.2,13.1,8.2,10.6,13.3,1.59],[114,170,"overnight",15676,8.0,11.2,16.0,8.5,11.1,14.9,2.09],[48,132,"overnight",15660,30.7,38.1,51.9,21.5,28.6,34.7,17.66],[244,243,"overnight",15631,4.2,7.2,10.8,7.6,10.5,16.4,1.27],[181,61,"overnight",15613,8.0,11.7,17.3,9.7,12.8,16.0,2.55],[42,41,"overnight",15444,4.3,7.3,11.4,7.6,10.4,13.5,1.24],[170,138,"overnight",15412,15.0,17.9,23.6,24.4,31.3,36.4,9.22],[145,138,"overnight",15398,13.3,16.3,20.6,17.4,27.9,35.5,7.7],[148,137,"overnight",15361,7.3,10.5,15.3,8.4,11.3,15.4,1.95],[164,48,"overnight",15343,6.0,9.4,14.7,7.1,10.2,13.3,1.57],[76,39,"overnight",15277,4.7,10.8,17.2,10.5,13.7,21.2,2.61],[216,197,"overnight",15244,4.2,7.7,12.4,9.2,12.1,15.5,1.58],[256,255,"overnight",15198,3.7,6.2,9.6,6.5,9.3,12.8,0.96],[263,138,"overnight",15192,13.6,16.0,19.8,25.9,32.0,36.5,8.48],[130,205,"overnight",15079,8.0,12.2,16.7,11.6,14.1,16.9,2.91],[68,138,"overnight",15045,21.0,24.6,30.8,21.2,26.2,29.8,10.42],[79,138,"overnight",14973,17.3,20.1,24.7,26.4,31.8,36.4,10.62],[114,107,"overnight",14973,5.4,8.3,12.5,7.4,10.0,13.5,1.39],[231,79,"overnight",14888,8.5,12.2,17.1,6.9,9.4,13.8,1.89],[205,132,"overnight",14884,12.2,16.7,23.7,14.7,19.5,25.2,5.37],[148,144,"overnight",14695,3.5,6.0,9.8,4.6,7.1,9.9,0.7],[148,80,"overnight",14680,9.1,12.9,20.8,10.8,15.1,21.1,3.29],[116,244,"overnight",14671,4.3,7.2,10.8,8.2,11.2,15.7,1.33],[129,260,"overnight",14666,5.0,8.2,12.4,7.5,10.9,16.9,1.51],[61,72,"overnight",14654,6.3,10.1,15.3,9.1,12.0,15.2,2.01],[129,173,"overnight",14652,5.8,9.6,14.0,6.8,9.0,12.2,1.43],[114,249,"overnight",14641,4.4,7.3,11.0,5.7,8.2,11.1,1.0],[148,48,"overnight",14629,15.5,20.2,27.0,9.7,12.5,15.8,4.15],[74,75,"overnight",14569,3.6,6.3,9.6,8.3,12.0,18.1,1.22],[114,231,"overnight",14564,5.4,8.2,12.3,7.0,9.6,12.9,1.3],[141,138,"overnight",14564,15.9,18.9,23.8,19.5,29.5,35.1,9.09],[158,79,"overnight",14542,8.8,12.5,17.7,6.3,8.2,10.5,1.68],[79,229,"overnight",14539,7.3,10.3,15.0,11.2,15.2,19.6,2.58],[148,90,"overnight",14535,9.8,13.6,18.7,7.8,10.2,13.2,2.28],[39,132,"overnight",14496,12.6,18.6,26.2,22.5,29.2,35.1,9.38],[218,132,"overnight",14412,6.2,9.6,16.0,14.5,21.7,29.2,3.49],[230,48,"overnight",14390,3.2,5.5,9.6,5.3,8.6,12.2,0.79],[164,145,"overnight",14357,11.1,14.7,21.9,10.9,14.2,17.1,3.52],[48,244,"overnight",14351,13.0,16.1,24.0,19.4,26.6,31.9,7.22],[249,87,"overnight",14317,9.6,12.8,17.4,8.7,11.3,14.7,2.35],[260,82,"overnight",1